{
  "id": "480a30f9-5302-46c6-8932-77afd2db6af4",
  "kind": "scenario",
  "name": "LeaveRequestApproved",
  "formatVersion": 1,
  "now": "2026-10-01T09:00:00Z",
  "users": {
    "requester": [
      "employee"
    ],
    "manager": [
      "department-manager"
    ],
    "manager-2": [
      "department-manager"
    ]
  },
  "steps": [
    {
      "type": "createRecord",
      "entity": "LeaveRequest",
      "as": "requester",
      "save": "request",
      "values": {
        "department": "d1b09f14-34f5-4831-9708-158361c860df",
        "leaveType": "annual",
        "firstDay": "2026-11-02",
        "lastDay": "2026-11-04",
        "reason": "Family trip",
        "status": "draft"
      }
    },
    {
      "type": "expectRecord",
      "record": "request",
      "values": {
        "number": "LR-2026-00001",
        "days": 3
      }
    },
    {
      "type": "startProcess",
      "process": "LeaveRequestApproval",
      "record": "request",
      "as": "requester"
    },
    {
      "type": "expectTask",
      "record": "request",
      "step": "managerApproval",
      "assignee": {
        "user": "manager-2"
      }
    },
    {
      "type": "completeTask",
      "record": "request",
      "step": "managerApproval",
      "outcome": "approve",
      "as": "manager-2",
      "values": {
        "decisionComment": "Enjoy"
      }
    },
    {
      "type": "expectInstance",
      "process": "LeaveRequestApproval",
      "record": "request",
      "state": "completed"
    },
    {
      "type": "expectRecord",
      "record": "request",
      "values": {
        "status": "approved",
        "decisionComment": "Enjoy"
      }
    }
  ]
}
