{
  "id": "09a79585-93aa-493e-a638-2c6791a51cb8",
  "kind": "scenario",
  "name": "AuditorCannotWrite",
  "formatVersion": 1,
  "now": "2026-10-01T09:00:00Z",
  "users": {
    "asset-manager": [
      "asset-manager"
    ],
    "auditor": [
      "auditor"
    ]
  },
  "steps": [
    {
      "type": "createRecord",
      "entity": "Asset",
      "as": "asset-manager",
      "save": "asset",
      "values": {
        "name": "Laptop of the employee",
        "holder": "employee"
      }
    },
    {
      "type": "createRecord",
      "entity": "Asset",
      "as": "auditor",
      "values": {
        "name": "Audit laptop"
      },
      "expect": "denied"
    },
    {
      "type": "updateRecord",
      "record": "asset",
      "as": "auditor",
      "values": {
        "name": "x"
      },
      "expect": "denied"
    },
    {
      "type": "deleteRecord",
      "record": "asset",
      "as": "auditor",
      "expect": "denied"
    },
    {
      "type": "createRecord",
      "entity": "Category",
      "as": "auditor",
      "values": {
        "name": "Printer"
      },
      "expect": "denied"
    },
    {
      "type": "expectRecord",
      "record": "asset",
      "values": {
        "name": "Laptop of the employee"
      }
    }
  ]
}
